{
  "workerId": "w_100542",
  "workerDescriptor": "example",
  "payGroup": {
    "id": "pg_weekly_usd",
    "descriptor": "Weekly USD Pay Group"
  },
  "paymentMethod": "DirectDeposit",
  "annualSalary": 95000.0,
  "hourlyRate": 32.5,
  "compensationFrequency": "Annual",
  "currency": "USD",
  "taxJurisdiction": "US-Federal"
}
